{
  "image_name": "rhel-9-golden-base",
  "image_version": "9.4-2026.06",
  "image_type": "rhel-golden-image",
  "created_at": "2026-06-11T18:00:00Z",
  "created_by": "transportvault-operator",
  "source_hostname": "rhel-golden-01",
  "source_disk": "/dev/nvme0n1",
  "source_disk_size": 536870912000,
  "partition_layout": [
    {
      "partition_number": 1,
      "filesystem": "vfat",
      "size_bytes": 629145600,
      "mount_point": "/boot/efi",
      "bootable": true,
      "label": "EFI"
    },
    {
      "partition_number": 2,
      "filesystem": "xfs",
      "size_bytes": 536241766400,
      "mount_point": "/",
      "bootable": false,
      "label": "root"
    }
  ],
  "tool_version": "0.1.0",
  "hash_algorithm": "sha256",
  "sha256": "0123456789abcdef0123456789abcdef0123456789abcdef0123456789abcdef",
  "notes": "Baseline RHEL 9 golden image with hardened field tooling."
}
